{
  "$schema": "https://json-schema.org/draft/2020-12/schema",
  "$id": "https://evimesh.org/schema/verification.schema.json",
  "title": "EviMesh Verification Receipt",
  "type": "object",
  "additionalProperties": false,
  "required": ["schema", "claim_revision_id", "contract_revision_id", "outcome", "verification_types", "context_mode", "saw_expected_outputs", "implementation_relation", "data_relation", "model_family", "findings"],
  "properties": {
    "schema": { "const": "srp.verification-receipt.v1" },
    "claim_revision_id": { "type": "string", "minLength": 1 },
    "contract_revision_id": { "type": "string", "minLength": 1 },
    "outcome": { "type": "string", "enum": ["supports", "refutes", "qualifies", "inconclusive"] },
    "verification_types": { "type": "array", "minItems": 1, "items": { "type": "string", "minLength": 1 } },
    "context_mode": { "type": "string", "enum": ["frontier", "full_trace", "adversarial", "blind"] },
    "saw_expected_outputs": { "type": "boolean" },
    "implementation_relation": { "type": "string", "minLength": 1 },
    "data_relation": { "type": "string", "minLength": 1 },
    "model_family": { "type": "string", "minLength": 1 },
    "findings": { "type": "array", "items": { "$ref": "#/$defs/finding" } }
  },
  "$defs": {
    "finding": {
      "type": "object",
      "additionalProperties": false,
      "required": ["severity", "code"],
      "properties": {
        "severity": { "type": "string", "enum": ["critical", "major", "warning", "note"] },
        "code": { "type": "string", "minLength": 1 },
        "message": { "type": "string", "minLength": 1 },
        "evidence": { "type": "array", "items": { "type": "string", "minLength": 1 } }
      }
    }
  }
}
